Match,Date,Vs,Venue,D/N*,How Dismissed,Out,Runs,Balls,S/R,,TotalRuns,Avg,S/R
1,2/5/2009,Delhi Capitals,Wanderers Stadium,Yes,c R Bhatia b A Nehra,1,14,13,107.69,,14,14,107.69
2,4/5/2009,Deccan Chargers,Buffalo Park,Yes,c H H Gibbs b T L Suman,1,31,33,93.94,,45,22.5,97.83
3,9/5/2009,Rajasthan Royals,Diamond Oval,Yes,lbw b S K Trivedi,1,10,12,83.33,,55,18.33,94.83
4,14/05/2009,Royal Challengers Bangalore,Kingsmead,No,c R V Uthappa b J H Kallis,1,5,9,55.56,,60,15,89.55
5,14/03/2010,Deccan Chargers,MA Chidambaram Stadium,Yes,b W P U J C Vaas,1,3,6,50,,63,12.6,86.3
6,16/03/2010,Kolkata Knight Riders,Eden Gardens,Yes,b L R Shukla,1,33,26,126.92,,96,16,96.97
7,19/03/2010,Delhi Capitals,Arun Jaitley Stadium,Yes,not out,0,14,6,233.33,,110,18.33,104.76
8,21/03/2010,Kings XI Punjab,MA Chidambaram Stadium,Yes,lbw b J Theron,1,0,3,0,,110,15.71,101.85
9,23/03/2010,Royal Challengers Bangalore,M Chinnaswamy Stadium,Yes,c E J G Morgan b A Kumble,1,3,7,42.86,,113,14.13,98.26
10,28/03/2010,Rajasthan Royals,Sardar Patel Stadium,Yes,run out,1,42,28,150,,155,17.22,108.39
11,31/03/2010,Royal Challengers Bangalore,MA Chidambaram Stadium,Yes,c M K Pandey b K P Pietersen,1,78,39,200,,233,23.3,128.02
12,3/4/2010,Rajasthan Royals,MA Chidambaram Stadium,Yes,c F Y Fazal b S R Watson,1,127,56,226.79,,360,32.73,151.26
13,6/4/2010,Mumbai Indians,MA Chidambaram Stadium,Yes,b Harbhajan Singh,1,14,17,82.35,,374,31.17,146.67
14,10/4/2010,Deccan Chargers,Vidarbha Cricket Association Stadium,Yes,run out,1,23,13,176.92,,397,30.54,148.13
15,13/04/2010,Kolkata Knight Riders,MA Chidambaram Stadium,Yes,not out,0,50,40,125,,447,34.38,145.13
16,15/04/2010,Delhi Capitals,MA Chidambaram Stadium,Yes,c †K D Karthik b A Nehra,1,17,11,154.55,,464,33.14,145.45
17,18/04/2010,Kings XI Punjab,Himachal Pradesh Cricket Association Stadium,Yes,st K C Sangakkara b R R Powar,1,13,11,118.18,,477,31.8,144.55
18,22/04/2010,Deccan Chargers,Dr DY Patil Sports Academy,Yes,lbw b R J Harris,1,15,10,150,,492,30.75,144.71
19,25/04/2010,Mumbai Indians,Dr DY Patil Sports Academy,Yes,c S S Tiwary b C R D Fernando,1,26,19,136.84,,518,30.47,144.29
20,8/4/2011,Kolkata Knight Riders,MA Chidambaram Stadium,Yes,c R Bhatia b Iqbal Abdulla,1,4,4,100,,522,29,143.8
21,13/04/2011,Kings XI Punjab,Punjab Cricket Association IS Bindra Stadium,Yes,st A C Gilchrist b P P Chawla,1,74,43,172.09,,596,31.37,146.8
22,16/04/2011,Royal Challengers Bangalore,MA Chidambaram Stadium,Yes,c Z Khan b R Ninan,1,31,21,147.62,,627,31.35,146.84
23,18/04/2011,Kochi Tuskers Kerala,Nehru Stadium (Kochi),Yes,lbw b N L T C Perera,1,28,18,155.56,,655,31.19,147.19
24,22/04/2011,Mumbai Indians,Wankhede Stadium,Yes,c R G Sharma b M M Patel,1,12,9,133.33,,667,30.32,146.92
25,25/04/2011,Pune Warriors,MA Chidambaram Stadium,Yes,c N L McCullum b A C Thomas,1,31,29,106.9,,698,30.35,144.51
26,27/04/2011,Pune Warriors,Dr DY Patil Sports Academy,Yes,c M Manhas b J D Ryder,1,31,31,100,,729,30.38,141.83
27,1/5/2011,Deccan Chargers,MA Chidambaram Stadium,Yes,b P P Ojha,1,3,14,21.43,,732,29.28,138.64
28,4/5/2011,Rajasthan Royals,MA Chidambaram Stadium,Yes,lbw b J Botha,1,5,6,83.33,,737,28.35,138.01
29,7/5/2011,Kolkata Knight Riders,Eden Gardens,Yes,c & b Iqbal Abdulla,1,5,14,35.71,,742,27.48,135.4
30,9/5/2011,Rajasthan Royals,Sawai Mansingh Stadium,Yes,run out,1,53,40,132.5,,795,28.39,135.2
31,12/5/2011,Delhi Capitals,MA Chidambaram Stadium,Yes,c Y Venugopal Rao b A B Agarkar,1,35,33,106.06,,830,28.62,133.66
32,18/05/2011,Kochi Tuskers Kerala,MA Chidambaram Stadium,Yes,b R P Singh,1,16,11,145.45,,846,28.2,133.86
33,22/05/2011,Royal Challengers Bangalore,M Chinnaswamy Stadium,Yes,c †A B de Villiers b S Aravind,1,6,9,66.67,,852,27.48,132.92
34,24/05/2011,Royal Challengers Bangalore,Wankhede Stadium,Yes,lbw b S Aravind,1,5,5,100,,857,26.78,132.66
35,28/05/2011,Royal Challengers Bangalore,MA Chidambaram Stadium,Yes,c D L Vettori b S Aravind,1,95,52,182.69,,952,28.85,136.39
36,4/4/2012,Mumbai Indians,MA Chidambaram Stadium,Yes,c Harbhajan Singh b J E C Franklin,1,10,17,58.82,,962,28.29,134.55
37,7/4/2012,Deccan Chargers,Dr YS Rajasekhara Reddy Cricket Stadium,Yes,b Ankit Sharma,1,2,5,40,,964,27.54,133.89
38,10/4/2012,Delhi Capitals,Arun Jaitley Stadium,Yes,run out,1,0,0,-,,964,26.78,133.89
39,12/4/2012,Royal Challengers Bangalore,MA Chidambaram Stadium,Yes,c & b M Muralitharan,1,11,15,73.33,,975,26.35,132.65
40,14/04/2012,Pune Warriors,Maharashtra Cricket Association Stadium,Yes,c A B Dinda b A D Mathews,1,8,11,72.73,,983,25.87,131.77
41,4/5/2012,Deccan Chargers,MA Chidambaram Stadium,Yes,c A Mishra b V Pratap Singh,1,14,11,127.27,,997,25.56,131.7
42,6/5/2012,Mumbai Indians,Wankhede Stadium,Yes,b R P Singh,1,41,29,141.38,,1038,25.95,132.06
43,10/5/2012,Rajasthan Royals,Sawai Mansingh Stadium,Yes,b S R Watson,1,0,5,0,,1038,25.32,131.23
44,12/5/2012,Delhi Capitals,MA Chidambaram Stadium,Yes,not out,0,48,40,120,,1086,26.49,130.69
45,14/05/2012,Kolkata Knight Riders,Eden Gardens,Yes,b S P Narine,1,36,25,144,,1122,26.71,131.07
46,17/05/2012,Kings XI Punjab,Himachal Pradesh Cricket Association Stadium,Yes,c †A C Gilchrist b P Kumar,1,10,14,71.43,,1132,26.33,130.11
47,23/05/2012,Mumbai Indians,M Chinnaswamy Stadium,Yes,c R G Sharma b D S Kulkarni,1,1,5,20,,1133,25.75,129.49
48,25/05/2012,Delhi Capitals,MA Chidambaram Stadium,Yes,run out,1,113,58,194.83,,1246,27.69,133.55
49,27/05/2012,Kolkata Knight Riders,MA Chidambaram Stadium,Yes,c Shakib Al Hasan b R Bhatia,1,42,32,131.25,,1288,28,133.47
50,6/4/2013,Mumbai Indians,MA Chidambaram Stadium,Yes,b M M Patel,1,5,8,62.5,,1293,27.51,132.89
51,10/4/2013,Kings XI Punjab,Punjab Cricket Association IS Bindra Stadium,Yes,not out,0,50,50,100,,1343,28.57,131.28
52,13/04/2013,Royal Challengers Bangalore,MA Chidambaram Stadium,Yes,c †K B A Arun Karthik b R Rampaul,1,2,5,40,,1345,28.02,130.84
53,15/04/2013,Pune Warriors,MA Chidambaram Stadium,Yes,c L R P L Taylor b A M Nayar,1,24,22,109.09,,1369,27.94,130.38
54,18/04/2013,Delhi Capitals,Arun Jaitley Stadium,Yes,lbw b M Morkel,1,18,13,138.46,,1387,27.74,130.48
55,20/04/2013,Kolkata Knight Riders,Eden Gardens,Yes,lbw b S M S M Senanayake,1,2,5,40,,1389,27.24,130.06
56,22/04/2013,Rajasthan Royals,MA Chidambaram Stadium,Yes,c & b A Chandila,1,3,5,60,,1392,26.77,129.73
57,25/04/2013,Sunrisers Hyderabad,MA Chidambaram Stadium,Yes,st Q de Kock b A Mishra,1,18,22,81.82,,1410,26.6,128.77
58,5/5/2013,Mumbai Indians,Wankhede Stadium,Yes,b M G Johnson,1,2,4,50,,1412,26.15,128.48
59,8/5/2013,Sunrisers Hyderabad,Rajiv Gandhi International Stadium,Yes,c †P A Patel b N L T C Perera,1,29,20,145,,1441,26.2,128.78
60,12/5/2013,Rajasthan Royals,Sawai Mansingh Stadium,Yes,run out,1,55,50,110,,1496,26.71,127.97
61,14/05/2013,Delhi Capitals,MA Chidambaram Stadium,Yes,run out,1,31,23,134.78,,1527,26.79,128.1
62,18/05/2013,Royal Challengers Bangalore,M Chinnaswamy Stadium,Yes,c C H Gayle b R Rampaul,1,32,19,168.42,,1559,26.88,128.74
63,21/05/2013,Mumbai Indians,Arun Jaitley Stadium,Yes,c D R Smith b K A Pollard,1,23,20,115,,1582,26.81,128.51
64,26/05/2013,Mumbai Indians,Eden Gardens,Yes,c R G Sharma b M G Johnson,1,18,20,90,,1600,26.67,127.9
65,17/04/2014,Royal Challengers Bangalore,Sharjah Cricket Stadium,No,b Y S Chahal,1,18,20,90,,1618,26.52,127.3
66,19/04/2014,Kolkata Knight Riders,Dubai International Cricket Stadium,Yes,run out,1,0,2,0,,1618,26.1,127.1
67,21/04/2014,Chennai Super Kings,Sheikh Zayed Stadium,Yes,c F du Plessis b M M Sharma,1,11,12,91.67,,1629,25.86,126.77
68,25/04/2014,Sunrisers Hyderabad,Dubai International Cricket Stadium,No,c D W Steyn b D J G Sammy,1,52,40,130,,1681,26.27,126.87
69,27/04/2014,Mumbai Indians,Sharjah Cricket Stadium,No,b R G Sharma,1,40,34,117.65,,1721,26.48,126.64
70,3/5/2014,Rajasthan Royals,Arun Jaitley Stadium,Yes,c S R Watson b J P Faulkner,1,13,11,118.18,,1734,26.27,126.57
71,5/5/2014,Chennai Super Kings,Arun Jaitley Stadium,Yes,c F du Plessis b R A Jadeja,1,35,30,116.67,,1769,26.4,126.36
72,7/5/2014,Kolkata Knight Riders,Arun Jaitley Stadium,Yes,c S P Narine b J H Kallis,1,24,20,120,,1793,26.37,126.27
73,13/05/2014,Royal Challengers Bangalore,M Chinnaswamy Stadium,Yes,lbw b M Muralitharan,1,1,3,33.33,,1794,26,126.07
74,19/05/2014,Kings XI Punjab,Arun Jaitley Stadium,Yes,c B E Hendricks b Sandeep Sharma,1,5,8,62.5,,1799,25.7,125.72
75,23/05/2014,Mumbai Indians,Wankhede Stadium,Yes,st A P Tare b S Gopal,1,8,12,66.67,,1807,25.45,125.23
76,10/4/2015,Rajasthan Royals,Maharashtra Cricket Association Stadium,Yes,run out,1,37,32,115.63,,1844,25.61,125.02
77,12/4/2015,Mumbai Indians,Wankhede Stadium,Yes,c J Suchith b Harbhajan Singh,1,35,29,120.69,,1879,25.74,124.93
78,15/04/2015,Delhi Capitals,Maharashtra Cricket Association Stadium,Yes,c J-P Duminy b A D Mathews,1,19,18,105.56,,1898,25.65,124.7
79,18/04/2015,Kolkata Knight Riders,Maharashtra Cricket Association Stadium,Yes,c A D Russell b U T Yadav,1,0,4,0,,1898,25.31,124.38
80,21/04/2015,Rajasthan Royals,Sardar Patel Stadium,No,run out,1,21,18,116.67,,1919,25.25,124.29
81,25/04/2015,Chennai Super Kings,MA Chidambaram Stadium,Yes,c D J J Bravo b R Ashwin,1,34,32,106.25,,1953,25.36,123.92
82,27/04/2015,Sunrisers Hyderabad,Punjab Cricket Association IS Bindra Stadium,Yes,run out,1,12,16,75,,1965,25.19,123.43
83,3/5/2015,Mumbai Indians,Punjab Cricket Association IS Bindra Stadium,Yes,c U B T Chand b Harbhajan Singh,1,39,34,114.71,,2004,25.37,123.25
84,6/5/2015,Royal Challengers Bangalore,M Chinnaswamy Stadium,No,b H V Patel,1,2,6,33.33,,2006,25.08,122.92
85,9/5/2015,Kolkata Knight Riders,Eden Gardens,Yes,b S P Narine,1,28,21,133.33,,2034,25.11,123.05
86,11/5/2015,Sunrisers Hyderabad,Rajiv Gandhi International Stadium,No,c S Dhawan b Bipul Sharma,1,24,18,133.33,,2058,25.1,123.16
87,11/4/2016,Gujarat Lions,Punjab Cricket Association IS Bindra Stadium,Yes,b R A Jadeja,1,42,34,123.53,,2100,25.3,123.17
88,15/04/2016,Delhi Capitals,Arun Jaitley Stadium,No,run out,1,1,5,20,,2101,25.01,122.87
89,17/04/2016,Rising Pune Supergiant,Punjab Cricket Association IS Bindra Stadium,Yes,c †M S Dhoni b M Ashwin,1,53,49,108.16,,2154,25.34,122.46
90,19/04/2016,Kolkata Knight Riders,Punjab Cricket Association IS Bindra Stadium,Yes,b P P Chawla,1,26,22,118.18,,2180,25.35,122.4
91,23/04/2016,Sunrisers Hyderabad,Rajiv Gandhi International Stadium,Yes,c †N V Ojha b B Kumar,1,2,3,66.67,,2182,25.08,122.31
92,25/04/2016,Mumbai Indians,Punjab Cricket Association IS Bindra Stadium,Yes,c J C Buttler b T G Southee,1,19,13,146.15,,2201,25.01,122.48
93,1/5/2016,Gujarat Lions,Saurashtra Cricket Association Stadium,Yes,c D J J Bravo b S Kaushik,1,55,41,134.15,,2256,25.35,122.74
94,4/5/2016,Kolkata Knight Riders,Eden Gardens,Yes,c Shakib Al Hasan b M Morkel,1,6,11,54.55,,2262,25.13,122.34
95,7/5/2016,Delhi Capitals,Punjab Cricket Association IS Bindra Stadium,Yes,c C R Brathwaite b C H Morris,1,25,16,156.25,,2287,25.13,122.63
96,9/5/2016,Royal Challengers Bangalore,Punjab Cricket Association IS Bindra Stadium,Yes,c Y S Chahal b S R Watson,1,89,57,156.14,,2376,25.83,123.62
97,13/05/2016,Mumbai Indians,Dr YS Rajasekhara Reddy Cricket Stadium,Yes,not out,0,54,52,103.85,,2430,26.41,123.1
98,15/05/2016,Sunrisers Hyderabad,Punjab Cricket Association IS Bindra Stadium,Yes,c D A Warner b Mustafizur Rahman,1,6,12,50,,2436,26.19,122.66
99,18/05/2016,Royal Challengers Bangalore,M Chinnaswamy Stadium,Yes,b S Aravind,1,16,8,200,,2452,26.09,122.97
100,21/05/2016,Rising Pune Supergiant,Dr YS Rajasekhara Reddy Cricket Stadium,Yes,b R Ashwin,1,59,41,143.9,,2511,26.43,123.39
101,15/04/2018,Kings XI Punjab,Punjab Cricket Association IS Bindra Stadium,Yes,c B B Sran b A J Tye,1,12,10,120,,2523,26.28,123.37
102,26/04/2019,Mumbai Indians,MA Chidambaram Stadium,Yes,c S A Yadav b J J Bumrah,1,38,35,108.57,,2561,26.4,123.13
103,7/5/2019,Mumbai Indians,MA Chidambaram Stadium,Yes,st Q de Kock b R D Chahar,1,26,26,100,,2587,26.4,122.84
